{
  "$schema": "https://json-schema.org/draft/2020-12/schema",
  "$id": "https://kevin-capability-map-public-review.vercel.app/schemas/hr-assessment-v0.5.schema.json",
  "title": "Kevin HR Assessment Record v0.5",
  "description": "Public-safe schema for internal HR evaluation records. This schema is for evidence organization and human review, not automated hiring, rejection, or compensation decisions.",
  "type": "object",
  "required": [
    "schema_version",
    "person",
    "application_input",
    "evaluation_run",
    "decision_record",
    "redaction_status"
  ],
  "additionalProperties": false,
  "properties": {
    "schema_version": {
      "type": "string",
      "const": "0.5"
    },
    "record_classification": {
      "type": "string",
      "enum": ["internal", "restricted"],
      "default": "internal"
    },
    "person": {
      "type": "object",
      "required": ["person_id", "source_type", "status", "consent_scope"],
      "additionalProperties": false,
      "properties": {
        "person_id": { "type": "string", "description": "Stable internal ID. Do not use a national ID, phone, email, or real name." },
        "source_type": { "type": "string", "enum": ["applicant", "intern", "contractor", "referral", "existing_pool", "unknown"] },
        "internal_name_ref": { "type": "string", "description": "Reference key only. Store the real name in a restricted source if needed." },
        "public_alias": { "type": "string", "description": "Optional irreversible alias for aggregated or de-identified public use." },
        "status": { "type": "string", "enum": ["staging", "needs_review", "active", "paused", "shortlist", "trial", "not_selected", "archived"] },
        "data_source": { "type": "string" },
        "consent_scope": { "type": "string", "enum": ["unknown", "evaluation_only", "talent_pool", "workforce_planning", "do_not_process"] },
        "retention_until": { "type": "string", "format": "date" },
        "created_at": { "type": "string", "format": "date-time" },
        "updated_at": { "type": "string", "format": "date-time" }
      }
    },
    "contact_profile": {
      "type": "object",
      "additionalProperties": false,
      "properties": {
        "preferred_contact_ref": { "type": "string", "description": "Reference key only. Do not publish phone, email, or private contact details." },
        "residence_area": { "type": "string", "description": "Use area-level location only; do not store full address here." },
        "commute_area": { "type": "string" },
        "available_days": { "type": "array", "items": { "type": "string" } },
        "available_hours_per_week": { "type": ["number", "null"], "minimum": 0 },
        "availability_notes": { "type": "string" }
      }
    },
    "talent_profile": {
      "type": "object",
      "additionalProperties": false,
      "properties": {
        "role_interest": { "type": "array", "items": { "type": "string", "enum": ["first_partner", "technical_automation", "content_research", "operations_support", "other"] } },
        "experience_summary": { "type": "string" },
        "skill_tags": { "type": "array", "items": { "type": "string" } },
        "language_tags": { "type": "array", "items": { "type": "string" } },
        "portfolio_refs": { "type": "array", "items": { "type": "string" } },
        "missing_fields": { "type": "array", "items": { "type": "string" } }
      }
    },
    "work_history": {
      "type": "object",
      "additionalProperties": false,
      "properties": {
        "covered_months": { "type": "array", "items": { "type": "string", "pattern": "^\\d{4}-\\d{2}$" } },
        "total_hours": { "type": ["number", "null"], "minimum": 0 },
        "task_types": { "type": "array", "items": { "type": "string" } },
        "attendance_signal": { "type": "string", "enum": ["unknown", "insufficient", "mixed", "reliable", "strong"] },
        "reliability_notes": { "type": "string" },
        "amounts_excluded": { "type": "boolean", "description": "Must be true for public or redacted outputs." }
      }
    },
    "application_input": {
      "type": "object",
      "required": ["raw_source_ref", "parsed_summary", "confidence_level", "review_required"],
      "additionalProperties": false,
      "properties": {
        "raw_source_ref": { "type": "string", "description": "Pointer to the source, not a public URL unless already approved." },
        "parsed_summary": { "type": "string" },
        "evidence_items": {
          "type": "array",
          "items": {
            "type": "object",
            "additionalProperties": false,
            "properties": {
              "evidence_type": { "type": "string" },
              "evidence_ref": { "type": "string" },
              "evidence_date": { "type": "string", "format": "date" },
              "confidence": { "type": "string", "enum": ["A", "B", "C"] }
            }
          }
        },
        "confidence_level": { "type": "string", "enum": ["A", "B", "C"] },
        "review_required": { "type": "boolean" }
      }
    },
    "evaluation_run": {
      "type": "object",
      "required": ["evaluation_id", "model_version", "role_template_id", "scores", "risk_flags", "human_review_required"],
      "additionalProperties": false,
      "properties": {
        "evaluation_id": { "type": "string" },
        "model_version": { "type": "string", "const": "hr-evaluation-v0.5" },
        "role_template_id": { "type": "string", "enum": ["first_partner", "technical_automation", "content_research"] },
        "scores": {
          "type": "object",
          "required": ["d1", "d2", "d3", "d4", "d5", "d6", "d7", "d8", "weighted_score"],
          "additionalProperties": false,
          "properties": {
            "d1": { "$ref": "#/$defs/score" },
            "d2": { "$ref": "#/$defs/score" },
            "d3": { "$ref": "#/$defs/score" },
            "d4": { "$ref": "#/$defs/score" },
            "d5": { "$ref": "#/$defs/score" },
            "d6": { "$ref": "#/$defs/score" },
            "d7": { "$ref": "#/$defs/score" },
            "d8": { "$ref": "#/$defs/score" },
            "weighted_score": { "type": "number", "minimum": 1, "maximum": 5 }
          }
        },
        "compensation_fit": { "type": "string", "enum": ["below_band", "within_band", "above_band", "manual_review_required", "not_evaluated"] },
        "planning_value": { "type": "string", "enum": ["unknown", "low", "medium", "high", "strategic"] },
        "risk_flags": { "type": "array", "items": { "type": "string" } },
        "human_review_required": { "type": "boolean" },
        "ai_summary": { "type": "string", "description": "Evidence summary only. Must not state final hiring, rejection, or compensation decisions." }
      }
    },
    "decision_record": {
      "type": "object",
      "required": ["stage", "recommended_next_step", "final_decision", "decision_owner"],
      "additionalProperties": false,
      "properties": {
        "stage": { "type": "string", "enum": ["staging", "screening", "trial", "interview", "shortlist", "offer_review", "active_pool", "archive"] },
        "recommended_next_step": { "type": "string", "enum": ["collect_more_data", "trial_task", "interview", "shortlist", "hold", "archive", "manual_review"] },
        "decision_owner": { "type": "string" },
        "final_decision": { "type": "string", "enum": ["none", "approved", "not_approved", "paused", "manual_review_required"] },
        "decision_reason": { "type": "string" },
        "override_reason": { "type": "string" },
        "reviewed_at": { "type": "string", "format": "date-time" }
      }
    },
    "redaction_status": {
      "type": "object",
      "required": ["public_allowed", "history_amounts_excluded", "sensitive_field_scan"],
      "additionalProperties": false,
      "properties": {
        "public_allowed": { "type": "boolean" },
        "history_amounts_excluded": { "type": "boolean" },
        "sensitive_field_scan": { "type": "string", "enum": ["not_run", "pass", "fail"] },
        "public_output_notes": { "type": "string" }
      }
    }
  },
  "$defs": {
    "score": {
      "type": "number",
      "minimum": 1,
      "maximum": 5
    }
  }
}
